"user_id","asked_by","question_time","question","response"
"12663f75-452d-48a6-bc36-329952060153","guest-1764876560821","2025-12-04 19:29:59.397","What is the safe cooking temperature for beef and poultry?","So, for beef, you want to cook it to at least 145°F (62.8°C) for medium rare, but if you're aiming for well-done, go for 160°F (71.1°C). For poultry, it's gotta be 165°F (73.9°C) all through. According to USDA FSIS, these temps kill off harmful bacteria. Cool, right? Now, do you want to know about the safety of cooking methods or how these temps affect the texture of the meat?"
"12663f75-452d-48a6-bc36-329952060153","guest-1764876560821","2025-12-04 19:31:11.246","What are the properties of a quality grade for meat.","So, when we talk about the quality grade of meat, we're looking at things like marbling (the fat within the muscle), texture, and color. For beef, the USDA grades like Prime, Choice, and Select are based on these factors. Prime has the most marbling, which means it's super tender and flavorful. Choice is good too, but with less marbling, and Select has the least. According to USDA standards, marbling affects juiciness and flavor. Now, do you want to dive into how these grades affect cooking or maybe look at how they're determined?"
"12663f75-452d-48a6-bc36-329952060153","guest-1764876560821","2025-12-04 19:33:36.536","What are the properties of a yield grade for meat.","Right, so yield grades for meat, particularly beef, are all about how much usable meat you get from the carcass. It's rated from 1 to 5, where 1 means the highest yield of lean meat, and 5 means the least. This grade looks at fat thickness, the area of the ribeye, and the percentage of kidney, pelvic, and heart fat (KPH). According to USDA standards, a lower yield grade means more lean meat, which is great for efficiency. Now, do you want to explore how yield grades impact meat pricing or maybe how they're measured in practice?"
"12663f75-452d-48a6-bc36-329952060153","guest-1764876560821","2025-12-04 19:35:28.929","What are the differences in Halal and Kosher practices for meat slaughter.","So, for Halal, the animal must be alive and healthy at the time of slaughter, and the method involves a swift cut to the throat with a sharp knife, draining all blood. Kosher slaughter, or Shechita, is similar but has stricter rules; the animal must be free from disease, and the cut must be done in one swift motion by a trained person called a Shochet, with specific prayers. Both aim for humane treatment, but Kosher has additional dietary laws like not mixing meat with dairy. According to USDA FSIS, both methods are regulated for safety. Now, do you want to know how these practices affect the meat's texture or flavor?"
"12663f75-452d-48a6-bc36-329952060153","guest-1764876560821","2025-12-04 19:37:01.744","What countries are the top beef producers in the world.","Well, the top beef producers in the world are typically the US, Brazil, and Argentina, with China and Australia not far behind. Now, do you want to explore how beef production in these countries might influence meat quality or safety standards?"
"12663f75-452d-48a6-bc36-329952060153","guest-1764876560821","2025-12-04 19:38:27.043","What are the properties of HACCP plan for raw ground beef.","So, for raw ground beef, a HACCP (Hazard Analysis and Critical Control Points) plan focuses on several key properties. It includes identifying potential hazards like bacterial contamination (E. coli, Salmonella), setting critical control points where these hazards can be controlled, like during grinding or storage. The plan outlines critical limits, like temperature controls, monitoring procedures, corrective actions if limits are not met, verification procedures to ensure the plan works, and record-keeping. According to USDA FSIS, this system ensures safety by preventing, eliminating, or reducing hazards to an acceptable level. Now, do you want to dive into how these control points are applied in practice or maybe look at an example of a corrective action?"
"1366a557-f0f4-4847-a3bb-9a10d92efd31","guest-1764876334058","2025-12-04 19:28:41.608","what is the difference between yeild grade and quality grade","So, great question! Yield grade (YG) and quality grade are different in meat science. Yield grade tells us about the amount of usable meat from the carcass, ranging from 1 to 5, where 1 is the highest yield. Quality grade, like USDA Prime, Choice, or Select, focuses on the meat's taste, tenderness, and juiciness, based on marbling (fat within the muscle). According to USDA FSIS, these grades help consumers and producers make informed decisions. Cool, right? Now, do you want to dive into how these grades affect meat processing or cooking?"
"1366a557-f0f4-4847-a3bb-9a10d92efd31","guest-1764876334058","2025-12-04 19:30:04.838","What are the different primals on a beef carccas","Right, so when we talk about beef, the carcass is broken down into primals. These are the main sections: Chuck, Rib, Loin, Round, Brisket, Shank, Plate, and Flank. Each primal has unique characteristics; for example, the Loin gives us tender cuts like the tenderloin, while the Round is leaner, great for roasts. According to USDA FSIS, this breakdown helps in processing and marketing. Cool, huh? Do you want to know more about how these primals are used in different meat products?"
"1366a557-f0f4-4847-a3bb-9a10d92efd31","guest-1764876334058","2025-12-04 19:31:37.213","What approval does organic food need to be in the market","So, for organic meat to hit the market, it needs the USDA Organic seal. This means it's been produced under strict guidelines, like no synthetic pesticides, no GMOs, and animals must be raised organically with organic feed. According to USDA FSIS, this certification ensures consumers get what they expect from 'organic'. Cool, right? Now, do you want to explore how this affects the processing of organic meats?"
"1366a557-f0f4-4847-a3bb-9a10d92efd31","guest-1764876334058","2025-12-04 19:33:33.775","What is the USDAs job in meat science","So, the USDA's role in meat science is pretty crucial. They're responsible for ensuring meat safety, grading, and labeling through the Food Safety and Inspection Service (FSIS). This includes inspecting meat processing facilities, setting standards for meat quality, and enforcing regulations to prevent foodborne illnesses. According to USDA FSIS, they're all about protecting public health and ensuring fair trade practices. Cool, right? Do you want to dive into how these inspections work in practice?"
"5a297bcc-08c7-41a5-8123-315a8aa65e8b","guest-1764876332326","2025-12-04 19:28:52.876","what is yield grade?","Great question! Yield grade is a measure used in the meat industry to estimate the amount of boneless, closely trimmed retail cuts from a beef carcass. It's based on factors like fat thickness, ribeye area, hot carcass weight, and the percentage of kidney, pelvic, and heart fat. Think of it like baking a cake; you want to know how much usable cake you'll get after trimming away the excess. According to USDA/FSIS, lower yield grades mean more lean meat yield. Cool, right? So, how does this relate to meat processing or do you have any other questions on this topic?"
"5f001b7d-9718-49b4-9c33-39ce76c82a59","guest-1764876326288","2025-12-04 19:28:38.037","What is the safe cooking temperature for beef and poultry?","So, for beef, you're looking at a safe internal temperature of **145°F** (62.8°C) with a 3-minute rest time. For poultry, it's gotta be **165°F** (73.9°C) right off the heat. According to USDA/FSIS guidelines, these temps ensure safety from pathogens. Great question! Have you tried cooking at these temperatures before, or is there another aspect of meat safety you're curious about?"
"5f001b7d-9718-49b4-9c33-39ce76c82a59","guest-1764876326288","2025-12-04 19:29:11.321","why is poultry going to increase in demand?","Well, there are a few reasons why poultry might see an uptick in demand. First off, it's often cheaper than beef or pork, which makes it a go-to for budget-conscious consumers. Also, health trends are pushing folks towards leaner proteins, and poultry fits that bill perfectly. Plus, with global populations growing, especially in developing countries, there's a shift towards more accessible meats like chicken. According to USDA/FSIS, poultry production is expected to rise to meet this demand. Have you noticed any changes in your local market or are you curious about how this might affect meat processing?"
"5f001b7d-9718-49b4-9c33-39ce76c82a59","guest-1764876326288","2025-12-04 19:29:56.71","how does this affect meat processing?","So, with the rise in poultry demand, meat processing plants are scaling up. They're investing in more efficient processing lines, automation to handle the volume, and stricter quality controls to ensure safety. According to USDA/FSIS, this also means more rigorous inspections. Have you ever wondered how these changes might impact the quality of the meat we buy?"
"5f001b7d-9718-49b4-9c33-39ce76c82a59","guest-1764876326288","2025-12-04 19:30:52.983","why is meat science important","Meat science is super important because it's all about ensuring the meat we eat is safe, nutritious, and tastes good. It involves understanding how to preserve meat (like curing or smoking), how to process it to enhance flavor and texture, and how to meet regulatory standards for safety. For instance, according to USDA/FSIS, meat science helps in setting those cooking temperatures we talked about earlier. Cool, right? Have you ever thought about how this knowledge could influence your cooking or buying habits?"
"67c7b63a-6722-4f5b-b93c-fc5bc11e51d5","guest-1764876335653","2025-12-04 19:28:47.993","meat science facts","Great question! Here's a quick fact: According to USDA/FSIS, nitrates and nitrites are used in cured meats like bacon to prevent botulism by inhibiting bacterial growth. Think of them like a security guard at a party, keeping the bad guys out. Now, what else would you like to know about meat preservation or processing? Maybe we can dive into smoking or fermentation next?"
"67c7b63a-6722-4f5b-b93c-fc5bc11e51d5","guest-1764876335653","2025-12-04 19:29:45.899","why is this important ","So, nitrates and nitrites are crucial because they not only preserve the meat but also keep it safe to eat by stopping harmful bacteria like Clostridium botulinum, which causes botulism. According to USDA/FSIS, without them, we'd have a much higher risk of foodborne illnesses. It's like having a safety net when you're walking a tightrope. Cool, right? Now, do you want to explore how these preservatives affect the flavor or color of meat?"
"81421244-832d-4651-ba02-6bc06963caf4","guest-1764876188198","2025-12-04 19:26:07.028","best way to season ribeye with a quality grade","So, for seasoning a ribeye with a quality grade, you'll want to keep it simple to let the meat's flavor shine. Just use salt and pepper, or maybe add a touch of garlic powder. According to USDA/FSIS, quality grades like Prime or Choice mean the meat has excellent marbling, which adds flavor. Think of it like this: you wouldn't over-season a fine wine, right? How do you feel about trying this method, or do you want to explore other seasoning options?"
"81421244-832d-4651-ba02-6bc06963caf4","guest-1764876188198","2025-12-04 19:27:24.334","where can i find the best prime meat","Well, for the best Prime meat, you're looking at high-end butchers or specialty meat markets. Here in Las Cruces, you might check out local places like 'El Patron Meat Market' or 'The Butcher Block'. According to USDA/FSIS, Prime is the top grade for marbling and tenderness. Ever thought about visiting these spots, or do you prefer online options?"
"81421244-832d-4651-ba02-6bc06963caf4","guest-1764876188198","2025-12-04 19:28:02.07","what kind of cow historically is the most sought out for ","Great question! Historically, the Angus breed has been the most sought after for prime beef due to its excellent marbling and flavor. Think of it like choosing the best ingredients for a gourmet dish; Angus is like the premium flour in baking. According to USDA/FSIS, this breed's quality is well-recognized. Have you ever tried Angus beef, or is there another breed you're curious about?"
"81421244-832d-4651-ba02-6bc06963caf4","guest-1764876188198","2025-12-04 19:28:55.233","how does meat affect your body ","So, when it comes to how meat affects your body, it's pretty fascinating. Meat's high in protein, which is like the building blocks for your muscles, right? It also gives you iron (heme iron, which is easily absorbed), B vitamins, and zinc. Think of it like fuel for your body's engine. According to USDA/FSIS, lean meats are recommended for a balanced diet. Cool, huh? Now, do you want to dive deeper into how different cuts or cooking methods might change these effects?"
"81421244-832d-4651-ba02-6bc06963caf4","guest-1764876188198","2025-12-04 19:30:32.14","what is a cheap cut that compared to rib eye and filet mignon is good but not as expenive","Right, if you're looking for a cut that's good but not as pricey as ribeye or filet mignon, consider the **chuck roast** or **flat iron steak**. Chuck roast, when slow-cooked, becomes tender and flavorful, like a ribeye but with more work. Flat iron steak, from the shoulder, offers a similar tenderness to filet but at a lower cost. According to USDA/FSIS, these cuts are from less prime areas but can be just as delicious with the right prep. Ever tried cooking one of these, or do you want some recipe ideas?"
"81421244-832d-4651-ba02-6bc06963caf4","guest-1764876188198","2025-12-04 19:31:25.006","what do you mean chuck is like rib eye with more work? can i grill a chuck in charboil like a steak in a carne asada","So, when I say chuck is like ribeye with more work, I mean it's tougher but gets tender with slow cooking. You can grill chuck for carne asada, but it's not ideal because it might stay tough. Think of it like trying to bake a cake too quickly; it won't set right. According to USDA/FSIS, for best results, marinate and cook low and slow. Have you tried slow-cooking chuck before, or do you want to explore other cooking methods?"
"81421244-832d-4651-ba02-6bc06963caf4","guest-1764876188198","2025-12-04 19:32:05.396","what if i slow cook it and then grill it is that an option?","Great idea! So, if you slow cook the chuck first, it'll become tender, then you can grill it for that charboil flavor. It's like giving the meat a spa day before a workout! According to USDA/FSIS, this method can enhance both texture and flavor. Have you tried this approach before, or do you want some tips on how to do it?"
"81421244-832d-4651-ba02-6bc06963caf4","guest-1764876188198","2025-12-04 19:32:20.523","so the usda has done this method?","Well, the USDA/FSIS doesn't specifically endorse cooking methods like slow cooking then grilling, but they do provide guidelines on safe cooking temperatures and methods to ensure meat is tender and safe. Think of it like following a recipe; the USDA gives you the safety steps, but you can get creative with the cooking process. Have you tried this method, or do you want to know more about USDA guidelines for meat preparation?"
"81421244-832d-4651-ba02-6bc06963caf4","guest-1764876188198","2025-12-04 19:41:44.881","what is yhow many cuts are in a chicken","So, when we talk about chicken cuts, there's quite a variety! You've got the breast, thighs, drumsticks, wings, and then you can break it down further into things like the tenderloin, back, neck, and even the giblets. Think of it like a puzzle where each piece has its own place. According to USDA/FSIS, proper handling of these cuts ensures safety. Have you ever tried cooking all these different parts, or is there a specific cut you're interested in?"
"8a1144c9-5ab2-4ce8-8e0e-d20e9e96fb69","guest-1764876348784","2025-12-04 19:35:00.423","What is the safe cooking temperature for beef and poultry?","So, for beef, you're looking at a safe internal temperature of **145°F** (62.8°C) with a 3-minute rest time. For poultry, it's gotta be **165°F** (73.9°C) right away. According to USDA FSIS guidelines, these temps kill harmful bacteria. Great question! Now, do you want to dive into how these temperatures affect the texture of the meat, or should we move on to something else?"
"8a1144c9-5ab2-4ce8-8e0e-d20e9e96fb69","guest-1764876348784","2025-12-04 19:36:11.401","sure","Right, so when beef hits **145°F**, it's still pretty juicy, but if you go higher, it gets tougher. Poultry at **165°F** ensures it's safe, but can make it a bit dry if overcooked. Think of it like baking bread; too long in the oven and it dries out. Based on USDA FSIS guidelines, these temps are key for safety. Cool? Now, do you want to explore how different cooking methods affect these outcomes, or should we talk about something else?"
"8a1144c9-5ab2-4ce8-8e0e-d20e9e96fb69","guest-1764876348784","2025-12-04 19:38:37.992","What is the best type of meat to produce in Las Cruces NM and why?","Well, in Las Cruces, NM, beef is king due to the region's cattle ranching tradition. The climate's just right for raising cattle, which impacts the quality of the meat. Think of it like this: just as certain plants thrive in certain soils, beef does well here. According to USDA FSIS, local conditions can influence meat quality. Great question! Now, do you want to know more about how the local environment affects meat processing, or should we look into something else?"
"8a1144c9-5ab2-4ce8-8e0e-d20e9e96fb69","guest-1764876348784","2025-12-04 19:43:41.135","another source said lamb was a good option. Do you agree? Why?","Well, that's interesting! Lamb can indeed be a good option in Las Cruces. The region's climate and terrain are similar to areas where lamb production thrives, like parts of New Mexico. It's like how certain wines are better from specific regions. According to USDA FSIS, local conditions can enhance meat quality. Cool? Now, do you want to explore how this affects the flavor profile of lamb, or should we talk about something else?"
"8dcafbae-3568-4166-a812-c57d5f16e30b","guest-1764876357757","2025-12-04 19:28:26.15","What is the safe cooking temperature for beef and poultry?","So, for beef, you're looking at a safe internal cooking temperature of **145°F** (62.8°C) with a 3-minute rest time. For poultry, it's **165°F** (73.9°C). According to USDA FSIS guidelines, these temps ensure safety from pathogens like Salmonella. Great question! Now, do you want to know about the effects of cooking at these temperatures on meat texture or flavor?"
"8dcafbae-3568-4166-a812-c57d5f16e30b","guest-1764876357757","2025-12-04 19:29:18.431","Explain USDA meat grading and inspection standards.","So, let's dive into USDA meat grading and inspection. The USDA grades meat for quality, like Prime, Choice, and Select, which reflects things like marbling (fat within the muscle) and tenderness. Prime is the top tier, with the most marbling, making it the most tender and flavorful. Now, for inspection, the USDA's Food Safety and Inspection Service (FSIS) checks every animal before and after slaughter to ensure it's safe, wholesome, and correctly labeled. This is mandatory for all meat sold in interstate commerce. According to USDA FSIS, this inspection covers everything from cleanliness to disease checks. Cool, right? Do you want to know more about how these grades affect cooking, or should we move on to something else?"
"8dcafbae-3568-4166-a812-c57d5f16e30b","guest-1764876357757","2025-12-04 19:29:27.787","how to process meat","So, for processing meat, here's the basic rundown: First, you've got **slaughtering**, where the animal is humanely killed. Then comes **dressing** (removing hide, organs, etc.), followed by **cooling** to prevent spoilage. After that, you might **cut** the meat into primal cuts or further into retail cuts. For preservation, you could **cure** (using salt or nitrates to preserve), **smoke** (for flavor and preservation), or **can** the meat. According to USDA FSIS, each step must follow strict guidelines to ensure safety. Now, do you want to dive deeper into any of these steps, or perhaps look at how these processes affect the meat's quality?"
"8dcafbae-3568-4166-a812-c57d5f16e30b","guest-1764876357757","2025-12-04 19:30:10.406","give me step by step directions on how to dress a beef","Great question! Here's how you'd dress a beef: First, you **hang** the carcass to cool. Then, **remove the hide** carefully to avoid contamination. Next, **eviscerate** by removing internal organs, ensuring you don't puncture anything to keep it clean. After that, **split the carcass** down the middle. Finally, **trim** any excess fat or unwanted parts. According to USDA FSIS, cleanliness is key here to prevent bacterial growth. Now, do you want to know more about any specific part of this process, or should we move on to another topic?"
"8dcafbae-3568-4166-a812-c57d5f16e30b","guest-1764876357757","2025-12-04 19:30:21.162","more detail","Alright, let's get into the nitty-gritty of dressing beef. After hanging to cool, you start by **removing the hide**. This is done with a knife, ensuring you cut just under the skin to avoid cutting into the muscle. You'll want to be careful around the head, legs, and tail. Then, for **evisceration**, you make a cut from the sternum to the pelvis, being super careful not to puncture the intestines or stomach. You remove the organs in a way that minimizes contamination; the liver, heart, and kidneys are often saved for offal. When you **split the carcass**, you use a saw to cut through the backbone, keeping the cut straight. Finally, **trimming** involves removing any excess fat or bruised meat. According to USDA FSIS, each step should be done in a sanitary environment to prevent bacterial growth. Now, do you feel comfortable with this process, or is there a specific part you'd like to explore further?"
"8dcafbae-3568-4166-a812-c57d5f16e30b","guest-1764876357757","2025-12-04 19:30:34.341","more detail","So, let's dive deeper into each step. When **removing the hide**, you start at the legs, making a circular cut around each, then proceed to the belly, cutting along the midline. You'll use a hide puller or your hands to peel it back, always pulling away from the body to avoid contamination. For **evisceration**, after the initial cut, you'll carefully lift the intestines and other organs out, using tools like a hook or your hands, ensuring you don't spill any contents. When **splitting the carcass**, precision is key; you align the saw with the spine, cutting through each vertebra. For **trimming**, you'll look for any discoloration or damage, using a sharp knife to remove these parts. According to USDA FSIS, cleanliness at each step is crucial to prevent contamination. Now, does this level of detail help, or is there something specific you're still curious about?"
"8dcafbae-3568-4166-a812-c57d5f16e30b","guest-1764876357757","2025-12-04 19:30:54.278","more","Alright, let's go even deeper. When **removing the hide**, after the initial cuts, you'll need to use a hide puller or your hands to separate the hide from the muscle, especially around the head where you might need to cut around the ears and eyes. For **evisceration**, you'll want to tie off the esophagus to prevent any leakage, then carefully lift out thepluck (lungs, heart, liver) together, followed by the intestines, which should be done with precision to avoid any spillage. When **splitting the carcass**, you'll align the saw with the spine, ensuring you cut through each vertebra evenly to keep the halves symmetrical. For **trimming**, you're looking for any signs of bruising or fat that might affect the meat quality, using a boning knife for precision. According to USDA FSIS, maintaining a sterile environment throughout is critical. Now, does this detail satisfy your curiosity, or is there a particular step you'd like to focus on?"
"8dcafbae-3568-4166-a812-c57d5f16e30b","guest-1764876357757","2025-12-04 19:31:02.296","more","Alright, let's really get into the weeds here. When **removing the hide**, after you've made your initial cuts, you'll need to be extra careful around the head. You'll cut around the ears, eyes, and snout, ensuring you don't damage the meat. For **evisceration**, after tying off the esophagus, you'll gently lift the pluck (lungs, heart, liver) out, keeping everything intact. Then, you'll carefully remove the intestines, ensuring no contents spill, which could contaminate the meat. When **splitting the carcass**, you'll want to keep the saw perfectly aligned with the spine, cutting through each vertebra with precision to maintain symmetry. For **trimming**, you're looking for any slight discoloration or fat that might affect flavor or texture, using a boning knife for fine work. According to USDA FSIS, every step must be done with utmost care to prevent contamination. Now, does this level of detail help, or is there something specific you're still curious about?"
