"user_id","asked_by","question_time","question","response"
"8dcafbae-3568-4166-a812-c57d5f16e30b","guest-1764876357757","2025-12-04 19:31:37.119","more. like act like im currently in the act of doing it","Alright, you're in the thick of it now. First, you've made your cuts around the legs and belly, now you're pulling the hide back. Keep it taut and pull away from the body, especially around the head, be gentle around the ears and eyes. Now, for evisceration, you've tied off the esophagus, good job. Gently lift the pluck out, keep it together. Now, carefully start on the intestines, watch your knife, we don't want any spillage. You're splitting the carcass, align your saw with the spine, keep it straight, feel each vertebra as you cut. For trimming, you're looking at the meat, any slight discoloration or excess fat, use your boning knife with precision. Remember, according to USDA FSIS, cleanliness is key here. How's it going so far, or do you need help with a specific step?"
"8dcafbae-3568-4166-a812-c57d5f16e30b","guest-1764876357757","2025-12-04 19:32:19.986","what happens if i puncture an intestine'","Oh no, if you puncture an intestine, you risk contaminating the meat with bacteria like E. coli or Salmonella. You'd need to immediately clean the area thoroughly, but often, that part of the carcass might need to be condemned to ensure safety. According to USDA FSIS, any contamination must be addressed to prevent foodborne illnesses. How are you feeling about continuing with the process, or do you need more info on this?"
"8dcafbae-3568-4166-a812-c57d5f16e30b","guest-1764876357757","2025-12-04 19:32:33.64","what does meat taste like","So, the taste of meat can really vary, right? It depends on the type, how it's been raised, fed, and processed. Beef, for instance, has a rich, savory flavor, especially if it's well-marbled. Pork can be milder, with a slight sweetness. According to USDA FSIS, processing like curing or smoking can add unique flavors, like the smoky taste in bacon. Now, do you want to explore how different processing methods affect the taste, or is there another aspect of meat science you're curious about?"
"8dcafbae-3568-4166-a812-c57d5f16e30b","guest-1764876357757","2025-12-04 19:32:56.035","i need more detail","Great question! So, let's dive deeper into how processing affects meat's taste. When you **cure** meat, like with salt or nitrates, it not only preserves but also imparts a salty, sometimes slightly sweet flavor. Think of how prosciutto or country ham tastes. **Smoking** adds a smoky, woody flavor; the type of wood used, like hickory or apple, can change the taste profile. For example, hickory gives a strong, bacon-like flavor, while apple wood is milder and sweeter. **Aging** beef, like dry aging, enhances the beefy flavor through enzymatic breakdown, making it more complex and sometimes a bit nutty. According to USDA FSIS, these methods are safe when done correctly. Now, do you want to know more about a specific processing method, or should we move on to another topic?"
"8dcafbae-3568-4166-a812-c57d5f16e30b","guest-1764876357757","2025-12-04 19:33:18.755","no i want detail on what it tastes like","Alright, let's get into the nitty-gritty of meat flavors. Beef, when cooked, has this deep, umami-rich taste, especially if it's well-marbled, giving it a buttery mouthfeel. Pork, on the other hand, has a milder, sometimes slightly sweet flavor, with a hint of fat that melts in your mouth. Chicken can be quite neutral, but when roasted, it picks up savory notes. Lamb has a distinct, gamey flavor, which some describe as earthy or even slightly sweet. When we talk about processed meats, like cured meats, they often have a salty, sometimes tangy taste from the curing process. Smoked meats, like bacon or smoked ham, carry that smoky, woody flavor, which can range from sweet to robust depending on the wood. According to USDA FSIS, these flavors are part of what makes processed meats unique. Now, does this detail help, or is there a specific type of meat you're curious about?"
"8dcafbae-3568-4166-a812-c57d5f16e30b","guest-1764876357757","2025-12-04 19:35:17.905","what is the best meat","Well, the 'best' meat really depends on what you're looking for. If we're talking about quality, USDA Prime beef is often considered the top due to its marbling, which gives it exceptional flavor and tenderness. For taste, some folks swear by aged beef for its complex flavor. If you're into processed meats, prosciutto or dry-cured ham might be your go-to for their unique, cured taste. According to USDA FSIS, all these meats are safe when processed correctly. Now, what do you think about these options, or is there a specific type of meat you're curious about?"
"8dcafbae-3568-4166-a812-c57d5f16e30b","guest-1764876357757","2025-12-04 19:35:30.43","best game meat","Great question! When it comes to game meat, many enthusiasts consider venison (deer) to be the best due to its lean, rich flavor with a hint of earthiness. It's often praised for its tenderness when prepared right. According to USDA FSIS, game meats need to be handled with care to ensure safety. Now, have you tried venison, or is there another game meat you're curious about?"
"8dcafbae-3568-4166-a812-c57d5f16e30b","guest-1764876357757","2025-12-04 19:35:56.364","how to hunt meat","So, hunting meat isn't exactly my area, but I can guide you on how to handle and process the meat post-hunt. Once you've hunted, you'd start with field dressing, which is similar to the initial steps of dressing we talked about earlier. You'd remove the internal organs to cool the carcass quickly, reducing bacterial growth. According to USDA FSIS, proper handling from the moment of harvest is crucial for safety. Now, would you like to know more about field dressing or should we focus on another aspect of meat science?"
"8dcafbae-3568-4166-a812-c57d5f16e30b","guest-1764876357757","2025-12-04 19:36:13.944","how is it different than beef","So, game meat like venison is different from beef in several ways. It's generally leaner, with less fat, which means it can be tougher if not cooked properly. The flavor is more gamey, with an earthy or wild taste due to the animal's diet and lifestyle. Beef, on the other hand, has a richer, more marbled texture, giving it a buttery flavor when cooked. According to USDA FSIS, both need careful handling, but game meat requires even more attention to prevent spoilage due to its lower fat content. Now, does this comparison help, or do you want to explore how these differences affect cooking methods?"
"8dcafbae-3568-4166-a812-c57d5f16e30b","guest-1764876357757","2025-12-04 19:37:54.013","what tastes better over a camp fire","Great question! Over a campfire, game meat like venison often tastes fantastic because the open flame can enhance its natural, earthy flavors, giving it a unique smoky taste. Beef, especially fatty cuts like ribeye, also does well as the fat renders out, adding richness. According to USDA FSIS, ensuring meat is cooked to the right temperature is key for safety. Now, have you tried cooking either over a campfire, or would you like to know more about how to prepare them for this setting?"
"8dcafbae-3568-4166-a812-c57d5f16e30b","guest-1764876357757","2025-12-04 19:38:24.578","yes","So, for cooking game meat like venison over a campfire, you'll want to keep it simple to let the natural flavors shine. Season lightly with salt and pepper, maybe some herbs like rosemary or thyme. Cook it over medium heat to avoid drying it out due to its lean nature. For beef, especially fatty cuts, you can sear it over high heat to get a nice crust, then move it to a cooler part of the fire to cook through. According to USDA FSIS, make sure both meats reach an internal temperature of at least 145°F for safety. Now, have you tried this method, or do you have any other questions about campfire cooking?"
"8dcafbae-3568-4166-a812-c57d5f16e30b","guest-1764876357757","2025-12-04 19:38:31.652","yes","Cool! So, when you've tried cooking venison or beef over a campfire, did you find one tasted better, or was there a technique you preferred? Let me know, or if you're curious about something else in meat science, we can dive into that."
"8dcafbae-3568-4166-a812-c57d5f16e30b","guest-1764876357757","2025-12-04 19:38:35.973","yes","Great! So, did you find one tasted better over the campfire, or was there a technique you preferred? Let me know, or if you're curious about something else in meat science, we can dive into that."
"8dcafbae-3568-4166-a812-c57d5f16e30b","guest-1764876357757","2025-12-04 19:38:40.602","yes","Awesome! So, which one did you find tasted better over the campfire, or was there a technique you preferred? Let me know, or if you're curious about something else in meat science, we can dive into that."
"8dcafbae-3568-4166-a812-c57d5f16e30b","guest-1764876357757","2025-12-04 19:38:44.354","no","Alright, no problem! Is there something else in meat science you'd like to explore, or are we good for now?"
"8dcafbae-3568-4166-a812-c57d5f16e30b","guest-1764876357757","2025-12-04 19:38:47.872","yes","Great! What specific aspect of meat science would you like to explore next?"
"8ed350c1-76c8-44ef-b4d0-e624dcc53340","guest-1764876320724","2025-12-04 19:29:26.43","What are the four primary components of meat?","So, the four primary components of meat are: **water, protein, fat, and minerals**. Great question! Water's the big one, making up about 75% of muscle tissue. Protein's key for structure and texture, fat adds flavor and juiciness, and minerals like iron are vital for nutrition. According to USDA/FSIS guidelines, these components are crucial for meat quality and safety. Now, do you want to dive deeper into how these components affect meat processing or preservation?"
"8ed350c1-76c8-44ef-b4d0-e624dcc53340","guest-1764876320724","2025-12-04 19:30:33.027","What is marbling in meat?","Right, marbling in meat refers to the visible fat within the lean muscle (like little white streaks or flecks). It's super important because it enhances flavor, tenderness, and juiciness when cooked. Think of it like the veins in marble stone, hence the name. According to USDA/FSIS, marbling is a key factor in grading beef quality. Cool, right? Now, how do you think marbling might affect the curing process?"
"8ed350c1-76c8-44ef-b4d0-e624dcc53340","guest-1764876320724","2025-12-04 19:31:28.404","What is the role of myoglobin in meat color?
","So, myoglobin is the protein that gives meat its color. When meat is fresh, myoglobin is in its oxygenated form, giving it that bright red color. As meat ages or is cooked, myoglobin changes state, turning brown or gray. Think of it like how leaves change color with the seasons. According to USDA/FSIS, this color change is a natural process and doesn't affect safety if handled properly. Now, how do you think this color change might influence consumer perception of meat quality?"
"8ed350c1-76c8-44ef-b4d0-e624dcc53340","guest-1764876320724","2025-12-04 19:33:16.344","Applying a prod to any animal's sensitive areas is considered a _________________.","Applying a prod to any animal's sensitive areas is considered a **violation of animal welfare standards**. According to USDA/FSIS, proper handling of livestock is crucial for both ethical reasons and meat quality. Now, how do you think this impacts the quality of meat from such animals?"
"8ed350c1-76c8-44ef-b4d0-e624dcc53340","guest-1764876320724","2025-12-04 19:36:51.447","Which type of packaging creates anaerobic conditions that are highly optimal for extending shelf life?","So, vacuum packaging is what you're looking for. It removes air (creates anaerobic conditions), which slows down spoilage and oxidation, extending the meat's shelf life. Think of it like sealing food in a space suit, no oxygen gets in! According to USDA/FSIS, this method is highly recommended for preserving meat quality. Now, how do you think this packaging method might affect the curing process?"
"9d9ba1a8-518a-433b-8aed-4f8755083fdc","guest-1764876316037","2025-12-04 19:27:44.513","What is the safe cooking temperature for beef and poultry?","So, for beef, you want to cook it to an internal temperature of **145°F** for medium-rare, or **160°F** for well-done. For poultry, it's **165°F** throughout. According to USDA FSIS guidelines, these temperatures ensure safety from pathogens. Cool, right? Now, do you have any questions about how these temperatures affect the texture or flavor of the meat?"
"9d9ba1a8-518a-433b-8aed-4f8755083fdc","guest-1764876316037","2025-12-04 19:28:16.944","How do curing salts prevent bacterial growth in meat?","So, curing salts like sodium nitrite or nitrate work by creating an environment where bacteria, especially pathogens like Clostridium botulinum, can't thrive. They do this by interfering with bacterial enzymes, which stops them from producing energy or growing. Think of it like putting a lock on the bacteria's food supply. According to USDA FSIS, this is crucial for food safety in cured meats. Cool question, right? Do you want to dive into how different bacteria react to these salts, or should we move on to another aspect of meat preservation?"
"9d9ba1a8-518a-433b-8aed-4f8755083fdc","guest-1764876316037","2025-12-04 19:28:52.029","what parts of a carcass are edible","Well, when we talk about what parts of a carcass are edible, it's pretty much everything, but with some caveats. Muscle meat (like steaks, chops), organs (liver, kidneys), fat, and even bones for making broth are all on the menu. But, according to USDA FSIS, some parts like the brain or spinal cord are restricted due to BSE (Bovine Spongiform Encephalopathy) concerns in cattle. Great topic, huh? Do you want to know more about how different cultures use various parts, or should we look into specific regulations?"
"9d9ba1a8-518a-433b-8aed-4f8755083fdc","guest-1764876316037","2025-12-04 19:29:12.289","what is yield grade","So, yield grade is all about how much usable meat you get from a carcass. It's a USDA system that goes from 1 to 5, where 1 means the highest yield of lean meat, and 5 means the least. It's based on factors like fat thickness, ribeye area, and carcass weight. Think of it like grading a test where more lean meat is like getting an A. According to USDA FSIS, this helps in predicting the cutability of the carcass. Cool, right? Do you want to dive into how this affects meat pricing or should we talk about quality grades next?"
"9d9ba1a8-518a-433b-8aed-4f8755083fdc","guest-1764876316037","2025-12-04 19:29:31.872","what is quality grade","Quality grade is about the meat's tenderness, juiciness, and flavor, not just the yield. The USDA grades beef from Prime (the best) to Canner (the least desirable). It's based on marbling (fat within the muscle), which affects taste and texture. Think of marbling like the richness in a cake. According to USDA FSIS, this grading helps consumers choose meat for specific cooking methods. Interesting, huh? Want to explore how quality grade impacts cooking, or should we discuss another aspect of meat science?"
"9d9ba1a8-518a-433b-8aed-4f8755083fdc","guest-1764876316037","2025-12-04 19:30:02.251","why are poultry sales increasing","Well, poultry sales are on the rise for a few reasons. First off, chicken is pretty affordable compared to beef or pork. Plus, it's versatile, quick to cook, and seen as a leaner option, which fits with today's health trends. According to USDA FSIS, consumer demand for convenience and health-conscious choices drives this. Cool, right? Do you want to delve into how this affects meat processing, or should we look at other trends in meat consumption?"
"9d9ba1a8-518a-433b-8aed-4f8755083fdc","guest-1764876316037","2025-12-04 19:30:38.692","why is meat important in our diet","So, meat's pretty vital in our diet for a bunch of reasons. It's packed with high-quality protein, which is essential for muscle repair and growth. Plus, it's a great source of vitamins like B12, iron (heme iron, which is super absorbable), and zinc. Think of meat like a nutrient powerhouse. According to USDA FSIS, these nutrients are crucial for various bodily functions. Great question, huh? Do you want to explore how different meats provide different nutrients, or should we talk about the role of meat in traditional diets?"
"9d9ba1a8-518a-433b-8aed-4f8755083fdc","guest-1764876316037","2025-12-04 19:34:42.612","what are crtical points","So, when we talk about critical points in meat processing, we're looking at the steps where food safety could be at risk if not handled properly. These are part of the HACCP (Hazard Analysis and Critical Control Points) system. Think of them like checkpoints in a race where you must meet certain standards or you're out. According to USDA FSIS, these points include things like cooking temperature, cooling rates, and storage conditions. Cool, right? Do you want to dive into specific examples of these critical points, or should we discuss how they're monitored?"
"9d9ba1a8-518a-433b-8aed-4f8755083fdc","guest-1764876316037","2025-12-04 19:35:28.855","what is the temperaturte danger zone","So, the temperature danger zone for meat is between 40°F and 140°F (4°C to 60°C). This is where bacteria can grow rapidly, which is a big no-no for food safety. Think of it like a playground for bacteria. According to USDA FSIS, keeping meat out of this zone is crucial to prevent foodborne illnesses. Interesting, huh? Do you want to know more about how to safely handle meat within this zone, or should we move on to another topic?"
"9d9ba1a8-518a-433b-8aed-4f8755083fdc","guest-1764876316037","2025-12-04 19:36:17.548","what are the big 9 allergans","Well, when it comes to allergens in meat processing, we're not directly talking about meat science, but I can tell you that the 'Big 9' allergens include milk, eggs, fish, shellfish, tree nuts, peanuts, wheat, soybeans, and sesame. These are important because cross-contamination can occur in processing facilities. According to USDA FSIS, facilities must manage these allergens to prevent reactions. Cool, right? Do you want to explore how meat processing plants handle allergen control, or should we stick to meat science topics?"
"9d9ba1a8-518a-433b-8aed-4f8755083fdc","guest-1764876316037","2025-12-04 19:37:00.785","what are bilogical hazards","So, biological hazards in meat science are mainly pathogens like bacteria, viruses, and parasites that can contaminate meat. We're talking about things like Salmonella, E. coli, Listeria, and Trichinella. They can cause foodborne illnesses if not controlled properly. Think of them like unwanted guests at a party. According to USDA FSIS, proper handling, cooking, and storage are key to managing these hazards. Cool, right? Do you want to dive into how these pathogens are controlled in meat processing, or should we look at another aspect of meat safety?"
"9d9ba1a8-518a-433b-8aed-4f8755083fdc","guest-1764876316037","2025-12-04 19:38:47.084","what is pathogen considered an adulterant in ground beef","So, in ground beef, pathogens like E. coli O157:H7 and Salmonella are considered adulterants. This means if they're found, the meat is deemed unsafe for consumption. Think of it like finding a contaminant in your water supply; it's not just a quality issue, it's a safety one. According to USDA FSIS, these pathogens must be controlled to zero tolerance in ground beef. Interesting, huh? Do you want to know more about how these pathogens are tested for, or should we discuss another aspect of meat safety?"
"9ef79497-e5dc-439e-80c5-5eba50455fef","guest-1764876368343","2025-12-04 19:30:27.152","give me the yield grade equation","So, the yield grade equation for beef is: **YG = 2.50 + (2.5 * %KPH) + (0.2 * fat thickness, in) + (0.0038 * hot carcass weight, lb) - (0.32 * ribeye area, sq in)**. Here, KPH stands for kidney, pelvic, and heart fat. According to USDA FSIS, this helps predict the amount of usable lean meat from a carcass. Cool, right? Do you want to dive into how each factor affects the yield grade, or is there something else you're curious about?"
"9ef79497-e5dc-439e-80c5-5eba50455fef","guest-1764876368343","2025-12-04 19:31:38.59","What are the different equations of the yield grade of every country in the world and different sectors of the us","Well, that's quite the deep dive into global yield grades! Unfortunately, there isn't a single source that compiles all these equations from around the world or different sectors in the US. Each country might have its own standards or might not use yield grades at all. In the US, for example, the USDA/FSIS standard we just talked about is pretty universal for beef, but for pork or lamb, or even for different sectors like organic versus conventional, the metrics might differ. Would you like me to look into specific countries or sectors, or should we focus on something else?"
"9ef79497-e5dc-439e-80c5-5eba50455fef","guest-1764876368343","2025-12-04 19:32:18.469","do you have the ability to translate these equations if given to you","Right, so I can definitely help translate those equations into something more understandable or into different formats if you provide them. Great question! According to USDA FSIS guidelines, we stick to standard equations, but I can adapt them for clarity. Do you have specific equations in mind, or are we talking about hypothetical ones?"
"9ef79497-e5dc-439e-80c5-5eba50455fef","guest-1764876368343","2025-12-04 19:33:57.081","give me the way each nation measures the quality grade of beef of each nation or union","So, that's a huge topic! Each country or union has its own system for grading beef quality. Here's a quick rundown:

- **USA**: USDA grades beef from Prime to Canner, focusing on marbling, maturity, and texture. According to USDA FSIS, marbling is key.

- **EU**: They use the EUROP system where E is the highest for conformation (shape) and U for fat cover.

- **Japan**: Their Wagyu beef is graded A1 to A5, with A5 being the best, considering marbling, color, texture, and fat quality.

- **Australia**: Similar to the US but with slight variations, they use MSA (Meat Standards Australia) which includes tenderness, juiciness, and flavor.

- **Brazil**: They grade beef based on fat cover, marbling, and muscle color, with a focus on export standards.

This is just a snapshot. Cool, right? Do you want to dive deeper into any specific country's system, or is there another aspect you're curious about?"
"9ef79497-e5dc-439e-80c5-5eba50455fef","guest-1764876368343","2025-12-04 19:36:07.046","give me a list to the different names of beef cuts of each part of the us since there is a huge variety","So, here's a fun fact: beef cuts can vary a lot across the US, but let's dive into some regional highlights:

- **Northeast**: They often use terms like 'Delmonico' for a ribeye or 'New York Strip' for a strip steak.

- **South**: You might hear 'Flat Iron' or 'Chuck Eye' more often, with a focus on BBQ cuts like 'Brisket'.

- **Midwest**: Known for 'T-bone' and 'Porterhouse', they also have unique names like 'Kansas City Strip'.

- **West**: 'Tri-tip' is big in California, and 'Santa Maria' style BBQ has its own cut names.

- **Texas**: They're famous for 'Fajita meat' which can be skirt or flank steak, and 'Ribeye' is often just called 'Rib'.

According to USDA FSIS, these names can sometimes overlap, but regional preferences shape local terminology. Cool, right? Do you want to explore how these cuts are used in different cuisines or is there another aspect you're curious about?"
"9ef79497-e5dc-439e-80c5-5eba50455fef","guest-1764876368343","2025-12-04 19:37:06.742","now of the loin area give me the different names used in slang terms of each part of the us ","So, for the loin area, here's how slang might differ:

- **Northeast**: They might call a strip steak 'Delmonico' or 'New York Strip'.

- **South**: 'Strip' or 'Kansas City Strip' for a strip steak, sometimes 'Sirloin' gets mixed in.

- **Midwest**: 'Strip' or 'KC Strip', but also 'T-bone' or 'Porterhouse' for the bone-in cuts.

- **West**: 'New York' for strip steak, 'Filet' for tenderloin, and 'Tri-tip' might be mentioned in context.

- **Texas**: 'Strip' or 'Ribeye' might be used loosely, but 'Fajita' could refer to tenderloin strips.

According to USDA FSIS, these slang terms can vary widely but reflect local culinary traditions. Cool, right? Do you want to know more about how these cuts are prepared in these regions, or is there another aspect you're curious about?"
"9ef79497-e5dc-439e-80c5-5eba50455fef","guest-1764876368343","2025-12-04 19:39:31.757","what are the different names for the loin area of the arab world","So, in the Arab world, the loin area might not have as many varied slang terms as in the US, but here's what we know: In countries like Saudi Arabia or UAE, they might refer to the loin as 'Lahm al-Zahr' (back meat) or 'Lahm al-Waraka' (loin meat). Cool, right? Do you want to explore how beef is traditionally prepared in these regions, or is there another aspect you're curious about?"
"b8a84fe8-2767-433c-8d5e-30c9613eab5e","guest-1763004147976","2025-12-04 19:13:14.409","you operate a processing facility and u produced a batch of ready to eat sausages , what pathogens are there","Great question! For ready-to-eat sausages, the main pathogens you need to watch out for are **Listeria monocytogenes** (Listeria), **Salmonella**, and **Clostridium perfringens**. Listeria is particularly sneaky because it can grow even in refrigerated conditions. According to USDA FSIS guidelines, these pathogens are critical in ensuring food safety. Now, do you want to know more about how to control these pathogens in your facility, or should we move on to another aspect of meat processing?"
